{"$schema":"https://json-schema.org/draft/2020-12/schema","$id":"CTR-MOD-001","title":"Module Manifest and Lifecycle","type":"object","additionalProperties":false,"required":["module_key","module_id","version","owner_role","capabilities","dependencies","permissions","cost_policy","data_policy","lifecycle"],"properties":{"module_key":{"type":"string","pattern":"^[a-z][a-z0-9-]*$","x-source":"MR-001 rejects a duplicate key."},"module_id":{"type":"string","pattern":"^MOD-(0[0-9]{2}|1[0-4][0-9])$","x-source":"Decision Register section 4.2 Registry (MOD-000..MOD-140)."},"version":{"type":"string","pattern":"^(0|[1-9]\\d*)\\.(0|[1-9]\\d*)\\.(0|[1-9]\\d*)(?:-[0-9A-Za-z-]+(?:\\.[0-9A-Za-z-]+)*)?(?:\\+[0-9A-Za-z-]+(?:\\.[0-9A-Za-z-]+)*)?$","x-source":"MR-001 rejects an invalid semver; Decision Register section 5.5 specifies Semantic Versioning, so a prerelease and build metadata are valid and must not be rejected."},"owner_role":{"enum":["A0","A1","A2","A3","A4","A5","A6"],"x-source":"Decision Register section 4.2 Registry assigns one owner role per module."},"capabilities":{"type":"array","minItems":1,"uniqueItems":true,"items":{"type":"object","additionalProperties":false,"required":["capability_key","version"],"properties":{"capability_key":{"type":"string","pattern":"^[a-z][a-z0-9.]*$","x-source":"Pattern is a DECLARED INFERENCE. MR-002 states no key syntax."},"version":{"type":"integer","minimum":1,"x-source":"Integer major version. DECLARED INFERENCE, and in tension with Decision Register section 5.5 which specifies Semantic Versioning for contracts; whether a capability version follows semver is an owner decision and is unresolved."}}},"x-source":"MR-002 requires deterministic resolution of a duplicate capability. Keying and versioning a capability is a DECLARED INFERENCE from that requirement; MR-002 does not state the shape."},"dependencies":{"type":"array","uniqueItems":true,"items":{"type":"object","additionalProperties":false,"required":["module_key","range"],"properties":{"module_key":{"type":"string","pattern":"^[a-z][a-z0-9-]*$"},"range":{"type":"string","minLength":1}}},"x-source":"MR-003 blocks a circular, missing or incompatible dependency with a stable error."},"permissions":{"type":"array","uniqueItems":true,"items":{"type":"string","minLength":1},"x-source":"MR-001 rejects a manifest missing its permission policy."},"cost_policy":{"type":"object","additionalProperties":false,"required":["metered"],"properties":{"metered":{"type":"boolean"},"usage_contract":{"type":"string","pattern":"^CTR-[A-Z]{3}-[0-9]{3}$"}},"x-source":"MR-001 rejects a manifest missing its cost policy."},"data_policy":{"type":"object","additionalProperties":false,"required":["classification","tenant_scoped"],"properties":{"classification":{"enum":["synthetic-only","tenant-data","permissioned-data"],"x-source":"MR-001 rejects a manifest missing its data policy. The three classification VALUES are a DECLARED INFERENCE: `synthetic-only` and `permissioned-data` follow CONTRIBUTING_AGENTS.md, and `tenant-data` appears nowhere in docs/ and is this contract's own term."},"tenant_scoped":{"type":"boolean"},"retention_reference":{"type":"string","minLength":1},"consent_reference":{"type":"string","minLength":1},"redaction_reference":{"type":"string","minLength":1}},"x-source":"MR-001 rejects a manifest missing its data policy."},"lifecycle":{"type":"object","additionalProperties":false,"required":["state","supports_drain"],"properties":{"state":{"enum":["registered","initializing","ready","draining","stopped","blocked"]},"supports_drain":{"type":"boolean"},"readiness":{"type":"object","additionalProperties":false,"required":["activated","reason"],"properties":{"activated":{"type":"boolean"},"reason":{"type":"string","pattern":"^readiness\\.[a-z_.]+$","x-source":"MR-006 requires support to see the last error without seeing a secret. A stable key rather than free text is a DECLARED INFERENCE from CTR-ERR-001, which uses a Thai message key for user-facing text."},"missing":{"type":"array","items":{"enum":["secret_handle","scope","entitlement","permission","health"]},"minItems":1,"x-source":"MR-004 names exactly \"missing secret/scope/entitlement\". `permission` and `health` are DECLARED INFERENCES from MR-004 Inputs, which lists \"secret handles, entitlement, health, permission\". `dependency` was present in an earlier draft with no source and has been removed."}}}},"x-source":"MR-005 names the four lifecycle hooks initialize / readiness / drain / shutdown, and MR-004 makes activation deny-by-default. The six state LABELS are a DECLARED INFERENCE: MR-005 names hooks, not states, and `registered`, `initializing`, `draining`, `stopped` and `blocked` appear nowhere in the workstream document. MR-004 does not mention a reason; requiring one is inferred from MR-006, which requires support to see the last error without seeing a secret."},"secret_handles":{"type":"array","uniqueItems":true,"items":{"type":"string","pattern":"^secret:[a-z0-9._-]+$"},"x-source":"PT-010 requires that a manifest sees a scoped REFERENCE only and that logs, events and jobs never contain a secret. The `secret:` token itself is a DECLARED INFERENCE - PT-010 gives \"reference only\" and names no syntax. See open_blockers: CTR-SEC-001 (owner A0+A1) is the chartered owner of handle syntax and this single-owner contract must not fix it."}},"allOf":[{"if":{"properties":{"lifecycle":{"properties":{"state":{"const":"ready"}},"required":["state"]}},"required":["lifecycle"]},"then":{"properties":{"lifecycle":{"required":["readiness"],"properties":{"readiness":{"properties":{"activated":{"const":true}},"required":["activated"]}}}},"x-rule":"MR-004 deny-by-default: a module cannot be ready unless activation readiness explicitly succeeded."}},{"if":{"properties":{"lifecycle":{"properties":{"state":{"const":"blocked"}},"required":["state"]}},"required":["lifecycle"]},"then":{"properties":{"lifecycle":{"required":["readiness"],"properties":{"readiness":{"properties":{"activated":{"const":false},"missing":{"type":"array","minItems":1}},"required":["activated","missing"]}}}},"x-rule":"MR-004: a blocked module must record what was missing, so support can act without seeing a secret (MR-006). An empty array satisfied the previous form; independent review showed \"missing\": [] was accepted while the rule read as closed."}},{"if":{"properties":{"data_policy":{"properties":{"classification":{"const":"permissioned-data"}},"required":["classification"]}},"required":["data_policy"]},"then":{"properties":{"data_policy":{"required":["classification","tenant_scoped","retention_reference","consent_reference","redaction_reference"],"properties":{"tenant_scoped":{"const":true}}}}},"x-rule":"CONTRIBUTING_AGENTS.md: \"A package using permissioned data must declare classification, consent, retention, and redaction.\" The schema previously required only classification and tenant_scoped, so permissioned-data with tenant_scoped false was accepted. Raised by independent security review."}]}
