{"module_key":"meta-connection","module_id":"MOD-110","version":"1.0.0","owner_role":"A6","capabilities":[{"capability_key":"meta.publish","version":1}],"dependencies":[{"module_key":"platform-kernel","range":"^1.0.0"}],"permissions":["meta.publish"],"cost_policy":{"metered":true,"usage_contract":"CTR-USG-001"},"data_policy":{"classification":"tenant-data","tenant_scoped":true,"retention_reference":"retention.meta.default"},"lifecycle":{"state":"blocked","supports_drain":true,"readiness":{"activated":false,"reason":"readiness.denied","missing":["secret_handle","entitlement"]}},"secret_handles":["secret:meta.page_token"]}
