{"module_key":"platform-kernel","module_id":"MOD-000","version":"1.0.0","owner_role":"A0","capabilities":[{"capability_key":"kernel.clock","version":1},{"capability_key":"kernel.ids","version":1}],"dependencies":[],"permissions":["kernel.read"],"cost_policy":{"metered":false},"data_policy":{"classification":"synthetic-only","tenant_scoped":false},"lifecycle":{"state":"ready","supports_drain":true,"readiness":{"activated":true,"reason":"readiness.activated"}}}
